name,description,price,category
Drone,Quadcopter with HD camera Polarized client-server hierarchy.,368.79,Gadgets
Science Fiction,Futuristic science fiction story Optional mobile archive.,212.73,Books
Dishwasher,Automatic dishwasher for easy cleaning Diverse fresh-thinking definition.,466.08,Home
Camera,Digital camera with high resolution Operative dedicated success.,44.75,Electronics
Doll,Beautiful doll with accessories Optimized upward-trending service-desk.,67.74,Toys
RC Car,Remote-controlled car with high speed Open-source multimedia methodology.,332.43,Toys
Jeans,Stylish denim jeans Diverse 3rdgeneration installation.,304.13,Clothing
Headphones,Headphones with noise cancellation Front-line radical synergy.,280.28,Electronics
Scarf,Cozy scarf for winter Cross-group national superstructure.,460.32,Clothing
Action Figure,Detailed action figure from popular series Switchable impactful concept.,420.35,Toys
Vacuum Cleaner,Efficient cleaning for your home Enterprise-wide real-time middleware.,490.41,Home
Refrigerator,Large capacity fridge with freezer Operative 3rdgeneration neural-net.,455.87,Home
Refrigerator,Large capacity fridge with freezer Multi-lateral interactive alliance.,341.22,Home
Jacket,Warm jacket for cold weather Operative contextually-based interface.,122.82,Clothing
Portable Charger,High capacity portable charger Ameliorated tertiary success.,454.29,Gadgets
VR Headset,Virtual reality headset for fun Seamless contextually-based project.,157.9,Gadgets
Building Blocks,Creative building blocks for kids Networked high-level focus group.,324.6,Toys
Mystery Novel,A gripping mystery novel Grass-roots mission-critical intranet.,80.44,Books
Cookbook,Recipes from around the world Profit-focused multi-state parallelism.,155.61,Books
Action Figure,Detailed action figure from popular series Multi-layered neutral structure.,117.14,Toys
Tablet,Compact tablet with high performance Optional multimedia utilization.,253.1,Electronics
Microwave,Compact microwave for quick meals Self-enabling bandwidth-monitored structure.,257.11,Home
Microwave,Compact microwave for quick meals Multi-layered zero tolerance initiative.,473.49,Home
Tablet,Compact tablet with high performance Total foreground implementation.,477.72,Electronics
Doll,Beautiful doll with accessories Team-oriented demand-driven data-warehouse.,174.49,Toys
Smart TV,High-definition smart television Configurable actuating policy.,130.82,Electronics
Smartphone,A high-tech gadget with reliability Team-oriented dedicated complexity.,322.08,Electronics
Drone,Quadcopter with HD camera Re-engineered upward-trending framework.,427.95,Gadgets
Action Figure,Detailed action figure from popular series Versatile coherent model.,321.31,Toys
Tablet,Compact tablet with high performance Mandatory context-sensitive knowledgebase.,125.04,Electronics
Smartphone,A high-tech gadget with reliability Switchable web-enabled info-mediaries.,82.1,Electronics
Sneakers,Trendy sneakers with good grip Virtual 24/7 alliance.,192.6,Clothing
Board Game,Fun board game for family and friends Ameliorated multi-tasking orchestration.,14.02,Toys
Building Blocks,Creative building blocks for kids Multi-tiered attitude-oriented task-force.,383.35,Toys
Smart TV,High-definition smart television Managed interactive migration.,70.04,Electronics
T-shirt,Comfortable cotton t-shirt Proactive incremental matrices.,120.8,Clothing
Self-Help,Guide to personal development and success Streamlined well-modulated emulation.,126.05,Books
Cookbook,Recipes from around the world Expanded value-added toolset.,331.53,Books
Tablet,Compact tablet with high performance Robust content-based initiative.,56.8,Electronics
Biography,Inspirational biography of a famous person Down-sized bandwidth-monitored protocol.,39.39,Books
Biography,Inspirational biography of a famous person Ameliorated executive methodology.,398.14,Books
Puzzle,Challenging puzzle to solve Exclusive content-based synergy.,219.65,Toys
Camera,Digital camera with high resolution Operative encompassing collaboration.,439.14,Electronics
Smartphone,A high-tech gadget with reliability Customer-focused client-server projection.,401.12,Electronics
Lamp,Elegant lamp for ambient lighting Extended clear-thinking instruction set.,182.99,Home
RC Car,Remote-controlled car with high speed Ergonomic disintermediate superstructure.,392.81,Toys
Dishwasher,Automatic dishwasher for easy cleaning Switchable disintermediate framework.,14.06,Home
Action Figure,Detailed action figure from popular series Profound transitional data-warehouse.,482.59,Toys
Board Game,Fun board game for family and friends Operative asymmetric encryption.,173.36,Toys
Fantasy Novel,An epic fantasy adventure Reduced leadingedge alliance.,294.72,Books
Camera,Digital camera with high resolution Enterprise-wide national knowledge user.,56.69,Electronics
Refrigerator,Large capacity fridge with freezer Expanded full-range toolset.,22.69,Home
T-shirt,Comfortable cotton t-shirt Inverse dedicated collaboration.,290.98,Clothing
Puzzle,Challenging puzzle to solve Cloned client-driven pricing structure.,492.26,Toys
Board Game,Fun board game for family and friends Synergized responsive methodology.,34.99,Toys
Refrigerator,Large capacity fridge with freezer Open-source systemic matrices.,279.26,Home
Vacuum Cleaner,Efficient cleaning for your home Pre-emptive value-added success.,426.75,Home
Cookbook,Recipes from around the world Ameliorated encompassing firmware.,193.56,Books
Science Fiction,Futuristic science fiction story Phased mobile ability.,153.58,Books
Smart Light Bulb,Energy-efficient smart light bulb Grass-roots hybrid standardization.,354.02,Gadgets
Self-Help,Guide to personal development and success Enhanced needs-based migration.,238.56,Books
Headphones,Headphones with noise cancellation Progressive context-sensitive conglomeration.,236.92,Electronics
Vacuum Cleaner,Efficient cleaning for your home Multi-lateral client-driven application.,423.56,Home
Drone,Quadcopter with HD camera Multi-channeled eco-centric open architecture.,426.07,Gadgets
Cookbook,Recipes from around the world Visionary zero administration solution.,311.29,Books
VR Headset,Virtual reality headset for fun Fundamental clear-thinking Internet solution.,352.42,Gadgets
Hat,Cool hat for sunny days Reactive multi-tasking infrastructure.,74.91,Clothing
Vacuum Cleaner,Efficient cleaning for your home Re-contextualized stable Graphic Interface.,267.77,Home
Headphones,Headphones with noise cancellation Adaptive solution-oriented application.,477.5,Electronics
Jacket,Warm jacket for cold weather Assimilated well-modulated Internet solution.,460.92,Clothing
Scarf,Cozy scarf for winter Multi-tiered multimedia infrastructure.,345.38,Clothing
Biography,Inspirational biography of a famous person Profit-focused reciprocal info-mediaries.,9.1,Books
VR Headset,Virtual reality headset for fun Down-sized responsive open system.,432.56,Gadgets
Cookbook,Recipes from around the world Front-line discrete infrastructure.,191.26,Books
Doll,Beautiful doll with accessories Synergistic empowering software.,479.23,Toys
Sneakers,Trendy sneakers with good grip Right-sized multimedia middleware.,178.97,Clothing
Jacket,Warm jacket for cold weather Advanced zero tolerance complexity.,125.65,Clothing
VR Headset,Virtual reality headset for fun Persevering composite pricing structure.,311.03,Gadgets
Jeans,Stylish denim jeans De-engineered bandwidth-monitored emulation.,411.87,Clothing
Dishwasher,Automatic dishwasher for easy cleaning Triple-buffered user-facing framework.,46.12,Home
Smartwatch,Smartwatch with fitness tracking Compatible global implementation.,194.3,Electronics
Mystery Novel,A gripping mystery novel De-engineered multi-tasking pricing structure.,255.67,Books
Cookbook,Recipes from around the world Inverse cohesive info-mediaries.,147.74,Books
Dishwasher,Automatic dishwasher for easy cleaning Switchable radical architecture.,313.08,Home
Doll,Beautiful doll with accessories Open-architected fault-tolerant approach.,24.22,Toys
Smart Home Hub,Central hub for all your smart devices Customizable mobile core.,183.32,Gadgets
Lamp,Elegant lamp for ambient lighting Persevering national firmware.,181.8,Home
Science Fiction,Futuristic science fiction story Virtual attitude-oriented infrastructure.,207.34,Books
Biography,Inspirational biography of a famous person Customizable heuristic structure.,300.66,Books
Smart TV,High-definition smart television User-centric zero administration info-mediaries.,89.22,Electronics
Smart Light Bulb,Energy-efficient smart light bulb Visionary clear-thinking core.,170.91,Gadgets
Tablet,Compact tablet with high performance Optimized bandwidth-monitored utilization.,486.68,Electronics
Jeans,Stylish denim jeans Customizable 24/7 core.,290.26,Clothing
Smart Light Bulb,Energy-efficient smart light bulb Face-to-face mission-critical capacity.,167.79,Gadgets
T-shirt,Comfortable cotton t-shirt Proactive real-time concept.,239.76,Clothing
Self-Help,Guide to personal development and success Organized needs-based contingency.,266.79,Books
Jeans,Stylish denim jeans Adaptive scalable orchestration.,142.1,Clothing
T-shirt,Comfortable cotton t-shirt Public-key hybrid knowledge user.,91.4,Clothing
Action Figure,Detailed action figure from popular series Profit-focused even-keeled installation.,398.44,Toys
Self-Help,Guide to personal development and success Enhanced 24hour encoding.,355.67,Books
Biography,Inspirational biography of a famous person Centralized 24/7 throughput.,469.82,Books
Lamp,Elegant lamp for ambient lighting Re-engineered analyzing synergy.,103.01,Home
Mystery Novel,A gripping mystery novel Expanded logistical forecast.,141.5,Books
Lamp,Elegant lamp for ambient lighting User-centric hybrid policy.,301.06,Home
Cookbook,Recipes from around the world Distributed zero administration instruction set.,140.64,Books
Vacuum Cleaner,Efficient cleaning for your home Face-to-face maximized open system.,418.04,Home
Sofa,Comfortable and stylish seating Streamlined local system engine.,94.07,Home
T-shirt,Comfortable cotton t-shirt Face-to-face even-keeled superstructure.,109.28,Clothing
Puzzle,Challenging puzzle to solve Right-sized actuating secured line.,44.91,Toys
Camera,Digital camera with high resolution Customer-focused non-volatile approach.,64.81,Electronics
Self-Help,Guide to personal development and success Pre-emptive analyzing encryption.,143.6,Books
Headphones,Headphones with noise cancellation Expanded composite website.,219.81,Electronics
Bluetooth Speaker,Wireless speaker with great quality Secured bifurcated benchmark.,66.49,Gadgets
Headphones,Headphones with noise cancellation User-centric 24/7 complexity.,41.93,Electronics
Microwave,Compact microwave for quick meals Profit-focused foreground application.,209.58,Home
Scarf,Cozy scarf for winter Business-focused solution-oriented methodology.,302.2,Clothing
Dishwasher,Automatic dishwasher for easy cleaning Intuitive zero tolerance concept.,384.99,Home
Tablet,Compact tablet with high performance Organized bottom-line structure.,311.15,Electronics
Hat,Cool hat for sunny days Configurable high-level synergy.,253.72,Clothing
Tablet,Compact tablet with high performance Cross-platform value-added artificial intelligence.,61.05,Electronics
Action Figure,Detailed action figure from popular series Intuitive zero administration application.,143.8,Toys
Mystery Novel,A gripping mystery novel Down-sized national workforce.,166.37,Books
Refrigerator,Large capacity fridge with freezer Team-oriented modular analyzer.,123.39,Home
Bluetooth Speaker,Wireless speaker with great quality Multi-channeled fresh-thinking productivity.,47.45,Gadgets
Portable Charger,High capacity portable charger Synchronized system-worthy framework.,258.43,Gadgets
Smart Home Hub,Central hub for all your smart devices Total intermediate neural-net.,171.75,Gadgets
Cookbook,Recipes from around the world Expanded discrete pricing structure.,367.47,Books
Drone,Quadcopter with HD camera Distributed value-added parallelism.,78.43,Gadgets
Sofa,Comfortable and stylish seating Multi-lateral systemic migration.,365.3,Home
Biography,Inspirational biography of a famous person Versatile needs-based array.,434.18,Books
Biography,Inspirational biography of a famous person Proactive executive data-warehouse.,278.51,Books
Building Blocks,Creative building blocks for kids Public-key discrete parallelism.,58.97,Toys
Science Fiction,Futuristic science fiction story Customizable empowering initiative.,120.42,Books
Mystery Novel,A gripping mystery novel Open-architected logistical flexibility.,419.45,Books
Microwave,Compact microwave for quick meals Fully-configurable bifurcated help-desk.,258.05,Home
Vacuum Cleaner,Efficient cleaning for your home Switchable neutral definition.,141.57,Home
Laptop,Portable computer for all your needs Public-key value-added middleware.,168.19,Electronics
Action Figure,Detailed action figure from popular series Function-based radical matrices.,251.61,Toys
Smartwatch,Smartwatch with fitness tracking Seamless systemic time-frame.,357.11,Electronics
VR Headset,Virtual reality headset for fun Phased clear-thinking function.,498.71,Gadgets
Camera,Digital camera with high resolution Implemented global contingency.,310.49,Electronics
Fantasy Novel,An epic fantasy adventure Progressive uniform toolset.,307.57,Books
Vacuum Cleaner,Efficient cleaning for your home Horizontal didactic leverage.,269.86,Home
Smartwatch,Smartwatch with fitness tracking Proactive explicit protocol.,66.94,Electronics
Laptop,Portable computer for all your needs Front-line regional moderator.,294.13,Electronics
Self-Help,Guide to personal development and success Multi-tiered content-based info-mediaries.,98.8,Books
Fantasy Novel,An epic fantasy adventure Right-sized non-volatile alliance.,378.45,Books
Vacuum Cleaner,Efficient cleaning for your home Cloned 5thgeneration artificial intelligence.,383.54,Home
Sofa,Comfortable and stylish seating Exclusive solution-oriented help-desk.,478.89,Home
Biography,Inspirational biography of a famous person Reactive 6thgeneration access.,225.9,Books
Drone,Quadcopter with HD camera Total user-facing project.,454.86,Gadgets
Laptop,Portable computer for all your needs Optional leadingedge attitude.,135.1,Electronics
Sneakers,Trendy sneakers with good grip Re-contextualized encompassing firmware.,469.55,Clothing
Dishwasher,Automatic dishwasher for easy cleaning Persevering bifurcated alliance.,487.03,Home
Mystery Novel,A gripping mystery novel Vision-oriented holistic service-desk.,248.29,Books
Action Figure,Detailed action figure from popular series Enterprise-wide asymmetric hub.,281.89,Toys
Headphones,Headphones with noise cancellation Upgradable radical info-mediaries.,298.47,Electronics
Dishwasher,Automatic dishwasher for easy cleaning Visionary multi-state open architecture.,356.63,Home
Board Game,Fun board game for family and friends Face-to-face bi-directional methodology.,54.69,Toys
Action Figure,Detailed action figure from popular series Profit-focused bandwidth-monitored project.,359.27,Toys
Portable Charger,High capacity portable charger Horizontal zero-defect flexibility.,448.96,Gadgets
Smart TV,High-definition smart television Future-proofed full-range leverage.,454.92,Electronics
Jeans,Stylish denim jeans Inverse didactic interface.,286.68,Clothing
Cookbook,Recipes from around the world Optional neutral adapter.,231.5,Books
T-shirt,Comfortable cotton t-shirt Down-sized well-modulated open architecture.,163.71,Clothing
Fantasy Novel,An epic fantasy adventure Decentralized secondary toolset.,52.93,Books
Smart Home Hub,Central hub for all your smart devices Versatile background Internet solution.,171.74,Gadgets
Cookbook,Recipes from around the world Operative directional installation.,369.14,Books
Drone,Quadcopter with HD camera Innovative modular orchestration.,485.76,Gadgets
Board Game,Fun board game for family and friends Ameliorated heuristic algorithm.,321.79,Toys
Laptop,Portable computer for all your needs Inverse static matrix.,207.41,Electronics
Smart Light Bulb,Energy-efficient smart light bulb Optional secondary instruction set.,154.07,Gadgets
Laptop,Portable computer for all your needs Optimized discrete complexity.,396.19,Electronics
Board Game,Fun board game for family and friends Re-contextualized leadingedge intranet.,73.98,Toys
Cookbook,Recipes from around the world Robust bi-directional orchestration.,55.82,Books
VR Headset,Virtual reality headset for fun Monitored explicit system engine.,76.4,Gadgets
T-shirt,Comfortable cotton t-shirt Cloned uniform support.,493.9,Clothing
Lamp,Elegant lamp for ambient lighting Quality-focused client-driven conglomeration.,14.28,Home
Self-Help,Guide to personal development and success Optimized methodical emulation.,362.97,Books
Doll,Beautiful doll with accessories Cross-platform background knowledge user.,323.71,Toys
Smart TV,High-definition smart television Multi-layered background alliance.,272.01,Electronics
Lamp,Elegant lamp for ambient lighting Versatile high-level architecture.,433.69,Home
Vacuum Cleaner,Efficient cleaning for your home Stand-alone fault-tolerant service-desk.,7.69,Home
Puzzle,Challenging puzzle to solve Automated empowering synergy.,330.1,Toys
Biography,Inspirational biography of a famous person Cloned value-added functionalities.,283.89,Books
Drone,Quadcopter with HD camera Multi-lateral neutral model.,263.74,Gadgets
Microwave,Compact microwave for quick meals Devolved bottom-line methodology.,106.67,Home
Dishwasher,Automatic dishwasher for easy cleaning Multi-channeled context-sensitive solution.,120.84,Home
Fantasy Novel,An epic fantasy adventure Realigned bi-directional hub.,84.42,Books
Portable Charger,High capacity portable charger User-centric mission-critical hub.,245.68,Gadgets
Lamp,Elegant lamp for ambient lighting Sharable logistical framework.,350.47,Home
Tablet,Compact tablet with high performance Balanced tertiary structure.,54.5,Electronics
Fantasy Novel,An epic fantasy adventure Assimilated background structure.,458.95,Books
Drone,Quadcopter with HD camera Up-sized explicit application.,268.61,Gadgets
Scarf,Cozy scarf for winter Public-key solution-oriented data-warehouse.,451.31,Clothing
Puzzle,Challenging puzzle to solve Progressive impactful moratorium.,209.29,Toys
Smart TV,High-definition smart television Visionary directional extranet.,93.75,Electronics
Dishwasher,Automatic dishwasher for easy cleaning Synergistic secondary implementation.,137.62,Home
Smart Home Hub,Central hub for all your smart devices Self-enabling logistical workforce.,469.61,Gadgets
Science Fiction,Futuristic science fiction story Profound multi-state time-frame.,469.03,Books
Hat,Cool hat for sunny days Function-based contextually-based open system.,479.04,Clothing
Vacuum Cleaner,Efficient cleaning for your home Open-source content-based functionalities.,184.34,Home
Sofa,Comfortable and stylish seating Face-to-face full-range service-desk.,221.63,Home
Mystery Novel,A gripping mystery novel Robust 24/7 encoding.,96.03,Books
Refrigerator,Large capacity fridge with freezer Ergonomic global algorithm.,138.08,Home
Camera,Digital camera with high resolution Fundamental client-server instruction set.,369.76,Electronics
Hat,Cool hat for sunny days Versatile systematic interface.,120.73,Clothing
T-shirt,Comfortable cotton t-shirt Front-line even-keeled hub.,285.04,Clothing
Lamp,Elegant lamp for ambient lighting Reduced encompassing superstructure.,139.74,Home
Portable Charger,High capacity portable charger Virtual attitude-oriented forecast.,55.83,Gadgets
Board Game,Fun board game for family and friends Versatile 4thgeneration product.,217.07,Toys
Bluetooth Speaker,Wireless speaker with great quality Intuitive value-added protocol.,14.72,Gadgets
VR Headset,Virtual reality headset for fun Automated grid-enabled circuit.,308.88,Gadgets
VR Headset,Virtual reality headset for fun De-engineered demand-driven knowledge user.,222.32,Gadgets
Lamp,Elegant lamp for ambient lighting Self-enabling human-resource customer loyalty.,476.75,Home
Board Game,Fun board game for family and friends Front-line client-driven architecture.,82.32,Toys
Cookbook,Recipes from around the world Universal attitude-oriented knowledge user.,290.75,Books
Microwave,Compact microwave for quick meals Centralized human-resource strategy.,11.76,Home
Mystery Novel,A gripping mystery novel Profound encompassing initiative.,431.25,Books
Doll,Beautiful doll with accessories Intuitive discrete budgetary management.,60.75,Toys
T-shirt,Comfortable cotton t-shirt Innovative human-resource policy.,254.84,Clothing
VR Headset,Virtual reality headset for fun Innovative systematic open architecture.,496.94,Gadgets
Board Game,Fun board game for family and friends Secured context-sensitive emulation.,128.34,Toys
Laptop,Portable computer for all your needs Organic local array.,497.12,Electronics
Building Blocks,Creative building blocks for kids Persevering neutral info-mediaries.,95.05,Toys
Vacuum Cleaner,Efficient cleaning for your home Synergistic full-range database.,84.49,Home
Portable Charger,High capacity portable charger Monitored exuding approach.,125.55,Gadgets
Dishwasher,Automatic dishwasher for easy cleaning Inverse uniform algorithm.,394.47,Home
Camera,Digital camera with high resolution Inverse neutral flexibility.,23.05,Electronics
Board Game,Fun board game for family and friends Future-proofed maximized groupware.,365.15,Toys
Jeans,Stylish denim jeans Polarized 5thgeneration conglomeration.,91.36,Clothing
Laptop,Portable computer for all your needs Team-oriented demand-driven Local Area Network.,300.81,Electronics
Smart Light Bulb,Energy-efficient smart light bulb Cloned reciprocal hierarchy.,168.5,Gadgets
Smartphone,A high-tech gadget with reliability Optional bi-directional toolset.,61.5,Electronics
Vacuum Cleaner,Efficient cleaning for your home Ergonomic composite hardware.,221.36,Home
Dishwasher,Automatic dishwasher for easy cleaning Profit-focused web-enabled success.,217.28,Home
Sofa,Comfortable and stylish seating Cross-group 24/7 emulation.,171.71,Home
RC Car,Remote-controlled car with high speed Virtual fresh-thinking initiative.,247.11,Toys
VR Headset,Virtual reality headset for fun Organic executive flexibility.,482.87,Gadgets
Mystery Novel,A gripping mystery novel Versatile encompassing secured line.,338.11,Books
Headphones,Headphones with noise cancellation Expanded radical support.,329.59,Electronics
Scarf,Cozy scarf for winter Enterprise-wide bifurcated implementation.,147.63,Clothing
Bluetooth Speaker,Wireless speaker with great quality Horizontal methodical array.,265.33,Gadgets
Board Game,Fun board game for family and friends Programmable empowering methodology.,329.07,Toys
Self-Help,Guide to personal development and success Down-sized background structure.,439.31,Books
Lamp,Elegant lamp for ambient lighting Re-contextualized coherent function.,308.89,Home
Dishwasher,Automatic dishwasher for easy cleaning Focused discrete orchestration.,445.25,Home
Microwave,Compact microwave for quick meals Extended uniform interface.,24.81,Home
Portable Charger,High capacity portable charger De-engineered dynamic project.,298.41,Gadgets
Smart Light Bulb,Energy-efficient smart light bulb Implemented eco-centric extranet.,121.73,Gadgets
VR Headset,Virtual reality headset for fun Universal responsive superstructure.,255.98,Gadgets
Biography,Inspirational biography of a famous person Centralized local interface.,121.46,Books
Self-Help,Guide to personal development and success Phased transitional benchmark.,16.48,Books
Smartwatch,Smartwatch with fitness tracking Open-architected client-server benchmark.,102.14,Electronics
Dishwasher,Automatic dishwasher for easy cleaning Upgradable web-enabled flexibility.,38.05,Home
Refrigerator,Large capacity fridge with freezer Synergistic heuristic strategy.,193.0,Home
Jacket,Warm jacket for cold weather Optional national alliance.,110.89,Clothing
Sofa,Comfortable and stylish seating Configurable mobile Graphic Interface.,343.24,Home
Lamp,Elegant lamp for ambient lighting Function-based cohesive process improvement.,211.64,Home
Refrigerator,Large capacity fridge with freezer Distributed logistical knowledge user.,287.31,Home
Dishwasher,Automatic dishwasher for easy cleaning Open-source object-oriented strategy.,413.36,Home
Smart Home Hub,Central hub for all your smart devices Customer-focused disintermediate knowledge user.,228.79,Gadgets
Portable Charger,High capacity portable charger Centralized user-facing budgetary management.,415.85,Gadgets
Sneakers,Trendy sneakers with good grip Assimilated multimedia service-desk.,331.08,Clothing
VR Headset,Virtual reality headset for fun Synchronized systemic encryption.,307.47,Gadgets
Sneakers,Trendy sneakers with good grip Business-focused bandwidth-monitored encoding.,292.02,Clothing
Hat,Cool hat for sunny days Visionary national secured line.,299.6,Clothing
Sneakers,Trendy sneakers with good grip Self-enabling actuating matrices.,253.62,Clothing
T-shirt,Comfortable cotton t-shirt Total cohesive migration.,81.84,Clothing
Cookbook,Recipes from around the world Seamless demand-driven knowledge user.,163.73,Books
Jacket,Warm jacket for cold weather Re-contextualized 5thgeneration challenge.,370.22,Clothing
Board Game,Fun board game for family and friends Universal secondary core.,64.41,Toys
Smartwatch,Smartwatch with fitness tracking Profound coherent open architecture.,484.2,Electronics
Hat,Cool hat for sunny days Cross-group needs-based core.,168.47,Clothing
Puzzle,Challenging puzzle to solve Grass-roots impactful Graphical User Interface.,223.1,Toys
Sofa,Comfortable and stylish seating Quality-focused asymmetric implementation.,76.55,Home
Smart Home Hub,Central hub for all your smart devices Digitized bottom-line algorithm.,341.36,Gadgets
Science Fiction,Futuristic science fiction story Quality-focused zero tolerance software.,409.03,Books
