name,description,price,category
Smart Light Bulb,Energy-efficient smart light bulb Automated 24/7 ability.,223.9,Gadgets
Drone,Quadcopter with HD camera Front-line multi-tasking synergy.,419.51,Gadgets
Biography,Inspirational biography of a famous person Cloned asymmetric infrastructure.,402.67,Books
Smart Home Hub,Central hub for all your smart devices Persevering background flexibility.,178.73,Gadgets
Sneakers,Trendy sneakers with good grip Ergonomic holistic array.,83.27,Clothing
Drone,Quadcopter with HD camera Open-source bifurcated conglomeration.,194.6,Gadgets
Refrigerator,Large capacity fridge with freezer Public-key didactic challenge.,284.94,Home
Smartphone,A high-tech gadget with reliability Compatible grid-enabled policy.,75.8,Electronics
Vacuum Cleaner,Efficient cleaning for your home Distributed bi-directional synergy.,167.84,Home
Jacket,Warm jacket for cold weather Persistent background budgetary management.,114.37,Clothing
Refrigerator,Large capacity fridge with freezer Reverse-engineered multimedia success.,240.38,Home
Dishwasher,Automatic dishwasher for easy cleaning Optimized systemic workforce.,494.47,Home
Hat,Cool hat for sunny days Implemented tangible time-frame.,331.13,Clothing
Smartphone,A high-tech gadget with reliability Digitized upward-trending leverage.,462.31,Electronics
Smartphone,A high-tech gadget with reliability User-centric global portal.,126.31,Electronics
Sneakers,Trendy sneakers with good grip Enhanced didactic challenge.,8.78,Clothing
Puzzle,Challenging puzzle to solve Proactive value-added secured line.,140.73,Toys
Sneakers,Trendy sneakers with good grip Universal multi-state hardware.,68.25,Clothing
Jacket,Warm jacket for cold weather Horizontal motivating challenge.,450.95,Clothing
Hat,Cool hat for sunny days Cross-platform asymmetric flexibility.,223.45,Clothing
VR Headset,Virtual reality headset for fun Ergonomic systematic pricing structure.,438.43,Gadgets
Lamp,Elegant lamp for ambient lighting Business-focused neutral ability.,439.1,Home
Hat,Cool hat for sunny days Multi-layered systematic project.,323.34,Clothing
Biography,Inspirational biography of a famous person Synergized dedicated projection.,245.93,Books
Doll,Beautiful doll with accessories Multi-lateral full-range core.,356.17,Toys
Board Game,Fun board game for family and friends Extended full-range matrices.,200.29,Toys
Dishwasher,Automatic dishwasher for easy cleaning Streamlined explicit system engine.,376.83,Home
Refrigerator,Large capacity fridge with freezer Compatible directional process improvement.,395.65,Home
Smartphone,A high-tech gadget with reliability Up-sized methodical emulation.,334.9,Electronics
Biography,Inspirational biography of a famous person Optional eco-centric neural-net.,381.22,Books
Tablet,Compact tablet with high performance De-engineered coherent info-mediaries.,97.52,Electronics
Building Blocks,Creative building blocks for kids Organized local installation.,333.46,Toys
Action Figure,Detailed action figure from popular series Visionary object-oriented Graphic Interface.,103.28,Toys
Bluetooth Speaker,Wireless speaker with great quality Fully-configurable methodical challenge.,55.8,Gadgets
T-shirt,Comfortable cotton t-shirt Inverse solution-oriented collaboration.,357.03,Clothing
Doll,Beautiful doll with accessories Triple-buffered static emulation.,368.54,Toys
Building Blocks,Creative building blocks for kids Mandatory human-resource portal.,467.48,Toys
RC Car,Remote-controlled car with high speed Expanded 4thgeneration standardization.,256.86,Toys
Action Figure,Detailed action figure from popular series Multi-lateral 24hour synergy.,318.22,Toys
Refrigerator,Large capacity fridge with freezer Phased multi-tasking array.,436.12,Home
Science Fiction,Futuristic science fiction story Cloned logistical success.,321.29,Books
Building Blocks,Creative building blocks for kids Intuitive holistic conglomeration.,271.74,Toys
Vacuum Cleaner,Efficient cleaning for your home Distributed explicit implementation.,171.26,Home
Lamp,Elegant lamp for ambient lighting Distributed actuating toolset.,244.24,Home
T-shirt,Comfortable cotton t-shirt Universal motivating challenge.,70.88,Clothing
Smart Light Bulb,Energy-efficient smart light bulb Organized content-based hardware.,135.47,Gadgets
VR Headset,Virtual reality headset for fun Virtual reciprocal software.,111.52,Gadgets
Fantasy Novel,An epic fantasy adventure Horizontal radical functionalities.,350.67,Books
Microwave,Compact microwave for quick meals Networked background complexity.,68.92,Home
Smart TV,High-definition smart television Organized content-based Local Area Network.,34.51,Electronics
Laptop,Portable computer for all your needs Focused multi-state pricing structure.,457.34,Electronics
Dishwasher,Automatic dishwasher for easy cleaning Focused client-driven data-warehouse.,91.78,Home
Scarf,Cozy scarf for winter Progressive systemic help-desk.,478.95,Clothing
Biography,Inspirational biography of a famous person Multi-tiered demand-driven budgetary management.,352.61,Books
Self-Help,Guide to personal development and success Implemented 4thgeneration algorithm.,377.67,Books
RC Car,Remote-controlled car with high speed User-centric regional flexibility.,217.16,Toys
Lamp,Elegant lamp for ambient lighting Phased actuating secured line.,430.75,Home
Smart Home Hub,Central hub for all your smart devices Exclusive mission-critical help-desk.,252.38,Gadgets
Dishwasher,Automatic dishwasher for easy cleaning Assimilated incremental website.,113.54,Home
Smart Home Hub,Central hub for all your smart devices Sharable stable migration.,27.6,Gadgets
Drone,Quadcopter with HD camera Multi-lateral solution-oriented pricing structure.,410.44,Gadgets
Portable Charger,High capacity portable charger Exclusive asymmetric Graphical User Interface.,166.27,Gadgets
Science Fiction,Futuristic science fiction story Stand-alone zero administration website.,459.47,Books
Mystery Novel,A gripping mystery novel Cross-platform reciprocal knowledge user.,19.45,Books
Fantasy Novel,An epic fantasy adventure Re-contextualized uniform system engine.,244.67,Books
Board Game,Fun board game for family and friends Exclusive tertiary ability.,297.24,Toys
T-shirt,Comfortable cotton t-shirt Enterprise-wide secondary superstructure.,294.42,Clothing
T-shirt,Comfortable cotton t-shirt Fundamental context-sensitive pricing structure.,92.72,Clothing
Sofa,Comfortable and stylish seating Ergonomic maximized interface.,119.35,Home
Doll,Beautiful doll with accessories Grass-roots stable groupware.,120.22,Toys
VR Headset,Virtual reality headset for fun Profit-focused leadingedge data-warehouse.,463.13,Gadgets
Fantasy Novel,An epic fantasy adventure Managed needs-based Internet solution.,25.21,Books
Vacuum Cleaner,Efficient cleaning for your home Programmable exuding moratorium.,59.48,Home
Jacket,Warm jacket for cold weather Upgradable heuristic core.,239.69,Clothing
Self-Help,Guide to personal development and success Object-based global initiative.,30.29,Books
Jacket,Warm jacket for cold weather Open-architected coherent open system.,152.07,Clothing
Bluetooth Speaker,Wireless speaker with great quality Multi-tiered contextually-based portal.,98.09,Gadgets
Jeans,Stylish denim jeans Synergistic interactive open architecture.,378.96,Clothing
Headphones,Headphones with noise cancellation Innovative web-enabled open system.,163.36,Electronics
Dishwasher,Automatic dishwasher for easy cleaning Focused didactic emulation.,210.39,Home
Laptop,Portable computer for all your needs Grass-roots 3rdgeneration open architecture.,321.4,Electronics
Building Blocks,Creative building blocks for kids Multi-layered needs-based productivity.,330.97,Toys
Lamp,Elegant lamp for ambient lighting Multi-tiered mission-critical matrix.,329.74,Home
Building Blocks,Creative building blocks for kids Grass-roots systematic open system.,9.58,Toys
Scarf,Cozy scarf for winter Fundamental foreground knowledge user.,43.65,Clothing
Hat,Cool hat for sunny days Re-engineered mobile middleware.,115.75,Clothing
Drone,Quadcopter with HD camera Devolved 24hour circuit.,338.4,Gadgets
VR Headset,Virtual reality headset for fun Versatile bifurcated productivity.,252.37,Gadgets
Sneakers,Trendy sneakers with good grip Inverse composite project.,207.6,Clothing
Cookbook,Recipes from around the world Seamless executive software.,223.6,Books
Dishwasher,Automatic dishwasher for easy cleaning Assimilated client-server standardization.,324.28,Home
Camera,Digital camera with high resolution Persevering mobile conglomeration.,339.96,Electronics
Jacket,Warm jacket for cold weather Enhanced user-facing capability.,237.28,Clothing
Bluetooth Speaker,Wireless speaker with great quality Re-contextualized logistical approach.,498.56,Gadgets
Doll,Beautiful doll with accessories Exclusive static benchmark.,469.69,Toys
Puzzle,Challenging puzzle to solve Triple-buffered composite website.,487.27,Toys
Action Figure,Detailed action figure from popular series Switchable zero-defect database.,105.74,Toys
Microwave,Compact microwave for quick meals Horizontal dynamic capacity.,106.43,Home
Smartwatch,Smartwatch with fitness tracking Digitized national groupware.,428.36,Electronics
Self-Help,Guide to personal development and success Grass-roots full-range utilization.,450.97,Books
VR Headset,Virtual reality headset for fun Intuitive high-level adapter.,272.0,Gadgets
Tablet,Compact tablet with high performance Re-contextualized asymmetric definition.,340.26,Electronics
VR Headset,Virtual reality headset for fun Polarized stable model.,152.4,Gadgets
Board Game,Fun board game for family and friends Object-based bottom-line infrastructure.,473.46,Toys
Lamp,Elegant lamp for ambient lighting Horizontal intangible product.,337.01,Home
Scarf,Cozy scarf for winter Persistent zero tolerance core.,402.55,Clothing
Doll,Beautiful doll with accessories Diverse transitional framework.,397.28,Toys
Jacket,Warm jacket for cold weather Self-enabling object-oriented encoding.,493.48,Clothing
Cookbook,Recipes from around the world De-engineered client-driven groupware.,201.3,Books
VR Headset,Virtual reality headset for fun Right-sized reciprocal function.,262.58,Gadgets
Jacket,Warm jacket for cold weather Streamlined eco-centric superstructure.,260.41,Clothing
Smart TV,High-definition smart television Cloned methodical instruction set.,307.04,Electronics
Action Figure,Detailed action figure from popular series Optional high-level collaboration.,441.68,Toys
Fantasy Novel,An epic fantasy adventure Programmable leadingedge product.,58.35,Books
Doll,Beautiful doll with accessories Phased explicit Local Area Network.,175.17,Toys
Refrigerator,Large capacity fridge with freezer Adaptive static info-mediaries.,336.23,Home
Headphones,Headphones with noise cancellation Horizontal analyzing complexity.,205.81,Electronics
RC Car,Remote-controlled car with high speed Monitored full-range conglomeration.,341.43,Toys
Action Figure,Detailed action figure from popular series Distributed user-facing policy.,69.27,Toys
Jacket,Warm jacket for cold weather Cross-group context-sensitive open system.,102.71,Clothing
Laptop,Portable computer for all your needs Open-source demand-driven initiative.,53.99,Electronics
Headphones,Headphones with noise cancellation Vision-oriented bi-directional moderator.,142.35,Electronics
Jeans,Stylish denim jeans Universal eco-centric firmware.,112.88,Clothing
Headphones,Headphones with noise cancellation Polarized uniform frame.,238.85,Electronics
Building Blocks,Creative building blocks for kids Upgradable homogeneous encryption.,296.33,Toys
T-shirt,Comfortable cotton t-shirt Open-architected attitude-oriented archive.,327.94,Clothing
Lamp,Elegant lamp for ambient lighting Team-oriented 6thgeneration hub.,44.12,Home
Doll,Beautiful doll with accessories Exclusive systematic service-desk.,184.94,Toys
Action Figure,Detailed action figure from popular series Re-contextualized 3rdgeneration initiative.,221.33,Toys
Cookbook,Recipes from around the world Front-line transitional data-warehouse.,182.68,Books
Sofa,Comfortable and stylish seating Centralized composite superstructure.,283.44,Home
Bluetooth Speaker,Wireless speaker with great quality Distributed eco-centric migration.,266.35,Gadgets
Scarf,Cozy scarf for winter Stand-alone non-volatile open architecture.,207.92,Clothing
Puzzle,Challenging puzzle to solve Realigned eco-centric data-warehouse.,200.31,Toys
Dishwasher,Automatic dishwasher for easy cleaning Managed directional website.,134.71,Home
Refrigerator,Large capacity fridge with freezer Re-engineered national Graphical User Interface.,330.64,Home
Science Fiction,Futuristic science fiction story Decentralized well-modulated application.,283.89,Books
Refrigerator,Large capacity fridge with freezer User-friendly analyzing architecture.,259.88,Home
Smart Light Bulb,Energy-efficient smart light bulb Digitized regional hub.,411.35,Gadgets
Science Fiction,Futuristic science fiction story Reduced systemic moratorium.,418.92,Books
Dishwasher,Automatic dishwasher for easy cleaning Organic intermediate toolset.,60.74,Home
Building Blocks,Creative building blocks for kids Cloned regional database.,39.96,Toys
Hat,Cool hat for sunny days Monitored object-oriented utilization.,294.43,Clothing
Jacket,Warm jacket for cold weather Diverse coherent help-desk.,360.01,Clothing
Smartphone,A high-tech gadget with reliability Assimilated logistical archive.,422.86,Electronics
Lamp,Elegant lamp for ambient lighting Operative heuristic framework.,469.58,Home
Doll,Beautiful doll with accessories Universal bottom-line initiative.,332.9,Toys
Headphones,Headphones with noise cancellation Right-sized holistic software.,117.44,Electronics
Dishwasher,Automatic dishwasher for easy cleaning Synergistic neutral hardware.,106.75,Home
Building Blocks,Creative building blocks for kids Diverse next generation collaboration.,271.11,Toys
Self-Help,Guide to personal development and success Switchable directional Graphic Interface.,196.13,Books
Camera,Digital camera with high resolution Streamlined intermediate firmware.,450.64,Electronics
Microwave,Compact microwave for quick meals Cross-platform non-volatile emulation.,6.85,Home
Jacket,Warm jacket for cold weather Visionary analyzing help-desk.,436.67,Clothing
Hat,Cool hat for sunny days Up-sized zero-defect time-frame.,9.81,Clothing
Biography,Inspirational biography of a famous person Mandatory discrete projection.,180.48,Books
Smart Light Bulb,Energy-efficient smart light bulb Exclusive dynamic standardization.,381.0,Gadgets
VR Headset,Virtual reality headset for fun Synergized even-keeled workforce.,310.14,Gadgets
Jacket,Warm jacket for cold weather Assimilated dedicated neural-net.,278.68,Clothing
Puzzle,Challenging puzzle to solve Fundamental impactful process improvement.,328.36,Toys
Tablet,Compact tablet with high performance Reverse-engineered holistic frame.,9.45,Electronics
Doll,Beautiful doll with accessories Realigned system-worthy project.,232.64,Toys
Self-Help,Guide to personal development and success Open-source multi-state application.,150.59,Books
Puzzle,Challenging puzzle to solve Enhanced attitude-oriented architecture.,295.46,Toys
Dishwasher,Automatic dishwasher for easy cleaning Team-oriented discrete emulation.,120.04,Home
Smart Home Hub,Central hub for all your smart devices Multi-lateral attitude-oriented support.,477.03,Gadgets
Microwave,Compact microwave for quick meals Right-sized 3rdgeneration capability.,7.18,Home
Science Fiction,Futuristic science fiction story Automated user-facing hierarchy.,230.9,Books
Tablet,Compact tablet with high performance Enterprise-wide upward-trending framework.,243.79,Electronics
Hat,Cool hat for sunny days Seamless client-server projection.,472.97,Clothing
Camera,Digital camera with high resolution Ergonomic national system engine.,58.22,Electronics
Building Blocks,Creative building blocks for kids Cloned systematic help-desk.,101.49,Toys
Cookbook,Recipes from around the world Total scalable workforce.,401.04,Books
Bluetooth Speaker,Wireless speaker with great quality Mandatory leadingedge capability.,120.8,Gadgets
RC Car,Remote-controlled car with high speed Seamless optimal flexibility.,5.45,Toys
Smartphone,A high-tech gadget with reliability Configurable solution-oriented archive.,265.63,Electronics
Refrigerator,Large capacity fridge with freezer Stand-alone static alliance.,339.13,Home
Vacuum Cleaner,Efficient cleaning for your home Streamlined attitude-oriented superstructure.,378.84,Home
Lamp,Elegant lamp for ambient lighting Up-sized transitional superstructure.,156.2,Home
Mystery Novel,A gripping mystery novel Configurable holistic throughput.,407.3,Books
Science Fiction,Futuristic science fiction story User-centric 3rdgeneration strategy.,27.56,Books
Building Blocks,Creative building blocks for kids Operative executive Internet solution.,104.44,Toys
Cookbook,Recipes from around the world Implemented asymmetric implementation.,204.08,Books
Mystery Novel,A gripping mystery novel Adaptive impactful software.,196.06,Books
Fantasy Novel,An epic fantasy adventure Expanded zero tolerance open architecture.,201.48,Books
Lamp,Elegant lamp for ambient lighting Customer-focused background complexity.,430.91,Home
Camera,Digital camera with high resolution Team-oriented web-enabled archive.,187.95,Electronics
Action Figure,Detailed action figure from popular series Optional asymmetric knowledge user.,446.33,Toys
Drone,Quadcopter with HD camera Networked eco-centric Local Area Network.,177.96,Gadgets
Bluetooth Speaker,Wireless speaker with great quality Programmable transitional Graphical User Interface.,180.37,Gadgets
Action Figure,Detailed action figure from popular series Cross-platform hybrid service-desk.,90.96,Toys
Science Fiction,Futuristic science fiction story Self-enabling bi-directional productivity.,208.58,Books
Cookbook,Recipes from around the world Triple-buffered actuating Graphic Interface.,171.76,Books
Self-Help,Guide to personal development and success Down-sized bandwidth-monitored model.,85.73,Books
Biography,Inspirational biography of a famous person Centralized reciprocal algorithm.,81.42,Books
Sofa,Comfortable and stylish seating Integrated radical installation.,321.32,Home
Board Game,Fun board game for family and friends Cross-group real-time superstructure.,201.26,Toys
Smartphone,A high-tech gadget with reliability Diverse empowering knowledge user.,279.33,Electronics
VR Headset,Virtual reality headset for fun Progressive local synergy.,481.69,Gadgets
Cookbook,Recipes from around the world Programmable executive extranet.,390.47,Books
Jacket,Warm jacket for cold weather Open-architected intermediate conglomeration.,71.38,Clothing
Biography,Inspirational biography of a famous person Persistent leadingedge time-frame.,28.31,Books
Mystery Novel,A gripping mystery novel Phased demand-driven forecast.,95.54,Books
Fantasy Novel,An epic fantasy adventure Expanded dynamic framework.,393.37,Books
Smart Light Bulb,Energy-efficient smart light bulb Multi-lateral background toolset.,259.02,Gadgets
Headphones,Headphones with noise cancellation Function-based tangible utilization.,383.36,Electronics
Board Game,Fun board game for family and friends Polarized radical moderator.,271.37,Toys
Sneakers,Trendy sneakers with good grip Balanced dedicated firmware.,219.87,Clothing
Fantasy Novel,An epic fantasy adventure Visionary discrete policy.,185.09,Books
Doll,Beautiful doll with accessories Enterprise-wide mission-critical capacity.,410.79,Toys
Jacket,Warm jacket for cold weather Enterprise-wide object-oriented moratorium.,443.43,Clothing
Sofa,Comfortable and stylish seating De-engineered grid-enabled methodology.,396.28,Home
Tablet,Compact tablet with high performance Compatible logistical moderator.,196.88,Electronics
Smart TV,High-definition smart television Optimized national software.,249.54,Electronics
Camera,Digital camera with high resolution Optimized well-modulated Graphic Interface.,16.7,Electronics
Science Fiction,Futuristic science fiction story Right-sized reciprocal algorithm.,151.19,Books
Smart TV,High-definition smart television Centralized explicit extranet.,264.97,Electronics
Doll,Beautiful doll with accessories Visionary zero tolerance project.,397.17,Toys
Puzzle,Challenging puzzle to solve Down-sized high-level Local Area Network.,251.28,Toys
Jeans,Stylish denim jeans Customizable uniform extranet.,190.51,Clothing
Drone,Quadcopter with HD camera Cross-platform zero-defect moderator.,138.38,Gadgets
Doll,Beautiful doll with accessories Customizable mobile process improvement.,465.17,Toys
Smart Light Bulb,Energy-efficient smart light bulb Assimilated human-resource focus group.,468.91,Gadgets
Bluetooth Speaker,Wireless speaker with great quality Synchronized homogeneous collaboration.,465.74,Gadgets
Mystery Novel,A gripping mystery novel Robust analyzing implementation.,99.39,Books
Headphones,Headphones with noise cancellation Synchronized reciprocal Local Area Network.,267.04,Electronics
Self-Help,Guide to personal development and success Pre-emptive tangible complexity.,116.2,Books
Bluetooth Speaker,Wireless speaker with great quality Pre-emptive encompassing leverage.,242.46,Gadgets
Action Figure,Detailed action figure from popular series Versatile eco-centric initiative.,380.37,Toys
Sofa,Comfortable and stylish seating Front-line dedicated projection.,183.86,Home
Jacket,Warm jacket for cold weather Re-engineered directional analyzer.,75.45,Clothing
Smart TV,High-definition smart television Expanded mission-critical moderator.,235.0,Electronics
Bluetooth Speaker,Wireless speaker with great quality Persistent needs-based pricing structure.,378.56,Gadgets
Doll,Beautiful doll with accessories Configurable executive monitoring.,460.66,Toys
Dishwasher,Automatic dishwasher for easy cleaning Switchable neutral software.,188.92,Home
T-shirt,Comfortable cotton t-shirt Networked 4thgeneration interface.,270.36,Clothing
Smart Home Hub,Central hub for all your smart devices Sharable web-enabled knowledge user.,160.51,Gadgets
Vacuum Cleaner,Efficient cleaning for your home Versatile impactful collaboration.,426.28,Home
Headphones,Headphones with noise cancellation Centralized human-resource service-desk.,162.13,Electronics
Camera,Digital camera with high resolution Integrated eco-centric throughput.,161.78,Electronics
Smart TV,High-definition smart television Monitored methodical knowledge user.,411.48,Electronics
Smartwatch,Smartwatch with fitness tracking Switchable directional matrix.,336.37,Electronics
Drone,Quadcopter with HD camera Horizontal static array.,93.5,Gadgets
Sofa,Comfortable and stylish seating Multi-tiered well-modulated extranet.,71.27,Home
Lamp,Elegant lamp for ambient lighting Progressive next generation knowledge user.,429.25,Home
Jacket,Warm jacket for cold weather Fundamental mission-critical matrices.,444.14,Clothing
Drone,Quadcopter with HD camera Re-contextualized systemic budgetary management.,421.54,Gadgets
Drone,Quadcopter with HD camera Stand-alone contextually-based open system.,247.73,Gadgets
Microwave,Compact microwave for quick meals Multi-tiered 24/7 utilization.,473.75,Home
Cookbook,Recipes from around the world Customizable exuding collaboration.,26.53,Books
Camera,Digital camera with high resolution Networked stable adapter.,218.66,Electronics
Biography,Inspirational biography of a famous person De-engineered encompassing functionalities.,194.92,Books
Hat,Cool hat for sunny days Distributed real-time system engine.,178.5,Clothing
Microwave,Compact microwave for quick meals Robust multi-state initiative.,423.78,Home
Building Blocks,Creative building blocks for kids Centralized incremental definition.,138.43,Toys
Dishwasher,Automatic dishwasher for easy cleaning Reverse-engineered local policy.,271.47,Home
Vacuum Cleaner,Efficient cleaning for your home Grass-roots fault-tolerant array.,343.6,Home
Action Figure,Detailed action figure from popular series Optional solution-oriented standardization.,422.3,Toys
Tablet,Compact tablet with high performance Programmable dedicated process improvement.,233.35,Electronics
Smartwatch,Smartwatch with fitness tracking Expanded modular migration.,93.62,Electronics
Biography,Inspirational biography of a famous person Fully-configurable motivating architecture.,411.98,Books
Tablet,Compact tablet with high performance Open-architected homogeneous superstructure.,460.5,Electronics
Smart TV,High-definition smart television Fundamental foreground info-mediaries.,483.96,Electronics
Laptop,Portable computer for all your needs Digitized interactive attitude.,12.39,Electronics
Mystery Novel,A gripping mystery novel Diverse real-time capacity.,333.57,Books
Fantasy Novel,An epic fantasy adventure Synchronized scalable knowledgebase.,55.31,Books
Fantasy Novel,An epic fantasy adventure Synchronized full-range Graphic Interface.,480.24,Books
Puzzle,Challenging puzzle to solve Function-based coherent collaboration.,120.29,Toys
Board Game,Fun board game for family and friends Pre-emptive bi-directional model.,173.43,Toys
Cookbook,Recipes from around the world Open-architected background customer loyalty.,373.75,Books
Scarf,Cozy scarf for winter Innovative stable website.,260.46,Clothing
Smartphone,A high-tech gadget with reliability Customer-focused systematic project.,257.28,Electronics
Smart TV,High-definition smart television Digitized client-server solution.,154.5,Electronics
Board Game,Fun board game for family and friends Integrated executive frame.,496.84,Toys
Mystery Novel,A gripping mystery novel Versatile composite moderator.,406.77,Books
Smart Light Bulb,Energy-efficient smart light bulb Advanced secondary time-frame.,117.19,Gadgets
Jeans,Stylish denim jeans Persevering human-resource emulation.,249.65,Clothing
Dishwasher,Automatic dishwasher for easy cleaning Optional discrete productivity.,36.58,Home
Sofa,Comfortable and stylish seating Cross-platform stable secured line.,77.08,Home
