name,description,price,category
Jeans,Stylish denim jeans Centralized clear-thinking toolset.,471.46,Clothing
Headphones,Headphones with noise cancellation Innovative client-server intranet.,73.15,Electronics
Doll,Beautiful doll with accessories Organic upward-trending focus group.,253.81,Toys
Headphones,Headphones with noise cancellation Balanced zero tolerance matrices.,76.74,Electronics
Scarf,Cozy scarf for winter Phased uniform implementation.,390.33,Clothing
Tablet,Compact tablet with high performance Streamlined analyzing project.,448.26,Electronics
Action Figure,Detailed action figure from popular series Ergonomic human-resource task-force.,185.73,Toys
Smart Home Hub,Central hub for all your smart devices Ameliorated local initiative.,425.77,Gadgets
Scarf,Cozy scarf for winter Assimilated zero tolerance software.,401.09,Clothing
Building Blocks,Creative building blocks for kids Optimized context-sensitive customer loyalty.,204.21,Toys
Fantasy Novel,An epic fantasy adventure Compatible national collaboration.,348.32,Books
Smartphone,A high-tech gadget with reliability Decentralized object-oriented ability.,355.47,Electronics
RC Car,Remote-controlled car with high speed Triple-buffered dynamic implementation.,220.39,Toys
Sneakers,Trendy sneakers with good grip Right-sized tertiary capability.,380.09,Clothing
Jacket,Warm jacket for cold weather Pre-emptive radical parallelism.,435.94,Clothing
Cookbook,Recipes from around the world Diverse non-volatile parallelism.,102.24,Books
Bluetooth Speaker,Wireless speaker with great quality Grass-roots client-server capacity.,28.05,Gadgets
Tablet,Compact tablet with high performance Phased fresh-thinking frame.,175.06,Electronics
Jacket,Warm jacket for cold weather Intuitive dedicated adapter.,6.09,Clothing
VR Headset,Virtual reality headset for fun Multi-layered analyzing artificial intelligence.,421.19,Gadgets
Headphones,Headphones with noise cancellation Networked fault-tolerant concept.,122.34,Electronics
T-shirt,Comfortable cotton t-shirt User-friendly dedicated implementation.,16.92,Clothing
Drone,Quadcopter with HD camera Front-line high-level product.,61.77,Gadgets
Board Game,Fun board game for family and friends Pre-emptive transitional application.,344.04,Toys
Drone,Quadcopter with HD camera Virtual holistic firmware.,223.31,Gadgets
Drone,Quadcopter with HD camera Total contextually-based paradigm.,460.55,Gadgets
Sneakers,Trendy sneakers with good grip Assimilated asymmetric middleware.,140.12,Clothing
Drone,Quadcopter with HD camera User-friendly 4thgeneration hierarchy.,180.18,Gadgets
Smart Home Hub,Central hub for all your smart devices Synergistic contextually-based service-desk.,432.34,Gadgets
Puzzle,Challenging puzzle to solve Assimilated context-sensitive knowledge user.,271.48,Toys
Smartphone,A high-tech gadget with reliability Optimized client-server interface.,158.7,Electronics
Microwave,Compact microwave for quick meals Cloned intermediate framework.,423.98,Home
Building Blocks,Creative building blocks for kids Self-enabling systematic software.,343.16,Toys
Smartwatch,Smartwatch with fitness tracking Devolved impactful flexibility.,360.51,Electronics
Smart Home Hub,Central hub for all your smart devices Adaptive 6thgeneration parallelism.,490.1,Gadgets
Portable Charger,High capacity portable charger Assimilated empowering approach.,380.5,Gadgets
Camera,Digital camera with high resolution Organized value-added challenge.,484.45,Electronics
T-shirt,Comfortable cotton t-shirt Automated holistic open architecture.,159.67,Clothing
VR Headset,Virtual reality headset for fun Re-contextualized incremental knowledgebase.,274.88,Gadgets
Smartphone,A high-tech gadget with reliability Open-source didactic intranet.,255.79,Electronics
T-shirt,Comfortable cotton t-shirt Implemented heuristic knowledge user.,362.91,Clothing
Science Fiction,Futuristic science fiction story Proactive analyzing hub.,338.19,Books
Science Fiction,Futuristic science fiction story Balanced static process improvement.,183.76,Books
Board Game,Fun board game for family and friends Devolved optimal Internet solution.,44.94,Toys
Doll,Beautiful doll with accessories Digitized background definition.,292.46,Toys
RC Car,Remote-controlled car with high speed Managed eco-centric throughput.,328.52,Toys
Smart TV,High-definition smart television Distributed asymmetric projection.,237.22,Electronics
Scarf,Cozy scarf for winter De-engineered systematic strategy.,279.63,Clothing
Doll,Beautiful doll with accessories Distributed web-enabled customer loyalty.,303.47,Toys
Cookbook,Recipes from around the world Adaptive 5thgeneration success.,56.05,Books
RC Car,Remote-controlled car with high speed Fully-configurable systemic alliance.,163.26,Toys
Scarf,Cozy scarf for winter Right-sized upward-trending collaboration.,16.44,Clothing
Mystery Novel,A gripping mystery novel Centralized static task-force.,456.62,Books
Biography,Inspirational biography of a famous person Front-line asymmetric forecast.,352.01,Books
Sneakers,Trendy sneakers with good grip Multi-layered optimal capability.,123.55,Clothing
Bluetooth Speaker,Wireless speaker with great quality Business-focused local alliance.,49.73,Gadgets
Smartwatch,Smartwatch with fitness tracking Implemented neutral utilization.,417.97,Electronics
Vacuum Cleaner,Efficient cleaning for your home Synergistic dedicated hardware.,236.65,Home
Camera,Digital camera with high resolution De-engineered hybrid moderator.,454.86,Electronics
Camera,Digital camera with high resolution Customer-focused disintermediate interface.,209.11,Electronics
Hat,Cool hat for sunny days Devolved context-sensitive archive.,365.64,Clothing
Smart Home Hub,Central hub for all your smart devices Persistent zero-defect contingency.,395.18,Gadgets
VR Headset,Virtual reality headset for fun Distributed zero tolerance emulation.,397.3,Gadgets
Vacuum Cleaner,Efficient cleaning for your home Expanded needs-based implementation.,201.19,Home
Cookbook,Recipes from around the world Multi-channeled intermediate leverage.,223.23,Books
Action Figure,Detailed action figure from popular series Innovative dynamic migration.,164.51,Toys
Microwave,Compact microwave for quick meals Grass-roots zero administration superstructure.,431.33,Home
Puzzle,Challenging puzzle to solve Public-key composite collaboration.,274.46,Toys
RC Car,Remote-controlled car with high speed Realigned tangible projection.,370.08,Toys
Refrigerator,Large capacity fridge with freezer Organized holistic parallelism.,442.91,Home
Microwave,Compact microwave for quick meals Switchable zero administration installation.,130.85,Home
T-shirt,Comfortable cotton t-shirt Multi-lateral high-level customer loyalty.,239.76,Clothing
Sofa,Comfortable and stylish seating User-friendly zero-defect intranet.,115.59,Home
Smartwatch,Smartwatch with fitness tracking Innovative empowering access.,14.12,Electronics
Camera,Digital camera with high resolution Progressive system-worthy synergy.,125.37,Electronics
Portable Charger,High capacity portable charger Multi-lateral disintermediate Internet solution.,382.66,Gadgets
Portable Charger,High capacity portable charger Reverse-engineered full-range function.,127.36,Gadgets
VR Headset,Virtual reality headset for fun Mandatory transitional groupware.,405.66,Gadgets
VR Headset,Virtual reality headset for fun Optional mission-critical extranet.,398.29,Gadgets
Fantasy Novel,An epic fantasy adventure Reverse-engineered stable strategy.,429.45,Books
Lamp,Elegant lamp for ambient lighting Vision-oriented object-oriented archive.,138.28,Home
Puzzle,Challenging puzzle to solve Programmable systematic archive.,267.36,Toys
Biography,Inspirational biography of a famous person Re-contextualized eco-centric artificial intelligence.,143.03,Books
Smart Light Bulb,Energy-efficient smart light bulb Triple-buffered tertiary neural-net.,316.96,Gadgets
Board Game,Fun board game for family and friends Integrated heuristic artificial intelligence.,347.77,Toys
Building Blocks,Creative building blocks for kids Synergized background knowledge user.,479.55,Toys
Lamp,Elegant lamp for ambient lighting Open-source asynchronous ability.,492.06,Home
Bluetooth Speaker,Wireless speaker with great quality User-centric bottom-line circuit.,123.27,Gadgets
Vacuum Cleaner,Efficient cleaning for your home Centralized systemic strategy.,428.98,Home
Laptop,Portable computer for all your needs Adaptive scalable support.,338.4,Electronics
Building Blocks,Creative building blocks for kids Advanced bandwidth-monitored array.,216.15,Toys
Smart Light Bulb,Energy-efficient smart light bulb Up-sized demand-driven definition.,276.19,Gadgets
Smart TV,High-definition smart television Quality-focused bottom-line archive.,236.17,Electronics
Headphones,Headphones with noise cancellation Down-sized 24hour analyzer.,419.36,Electronics
Smart Home Hub,Central hub for all your smart devices Implemented bifurcated collaboration.,154.91,Gadgets
Biography,Inspirational biography of a famous person Programmable optimal middleware.,494.52,Books
Doll,Beautiful doll with accessories Profound incremental Graphic Interface.,250.52,Toys
Puzzle,Challenging puzzle to solve Multi-channeled real-time secured line.,332.33,Toys
Portable Charger,High capacity portable charger Profound next generation approach.,334.22,Gadgets
Smartphone,A high-tech gadget with reliability Progressive systemic utilization.,67.67,Electronics
Bluetooth Speaker,Wireless speaker with great quality Adaptive static emulation.,475.81,Gadgets
Headphones,Headphones with noise cancellation Progressive context-sensitive artificial intelligence.,428.07,Electronics
Portable Charger,High capacity portable charger Diverse holistic matrix.,216.59,Gadgets
Smart Home Hub,Central hub for all your smart devices Phased background functionalities.,222.7,Gadgets
Doll,Beautiful doll with accessories Business-focused upward-trending projection.,488.39,Toys
Hat,Cool hat for sunny days Networked foreground hierarchy.,66.32,Clothing
Jeans,Stylish denim jeans Advanced clear-thinking structure.,30.03,Clothing
Microwave,Compact microwave for quick meals Vision-oriented discrete implementation.,82.52,Home
Doll,Beautiful doll with accessories Adaptive 4thgeneration archive.,61.61,Toys
Science Fiction,Futuristic science fiction story Team-oriented even-keeled application.,346.94,Books
Microwave,Compact microwave for quick meals Function-based 3rdgeneration system engine.,38.27,Home
Doll,Beautiful doll with accessories Compatible grid-enabled neural-net.,5.69,Toys
Sneakers,Trendy sneakers with good grip Integrated background Internet solution.,396.99,Clothing
Cookbook,Recipes from around the world User-friendly dynamic instruction set.,236.38,Books
Dishwasher,Automatic dishwasher for easy cleaning Synergistic bifurcated artificial intelligence.,438.38,Home
Drone,Quadcopter with HD camera Ameliorated full-range analyzer.,444.86,Gadgets
Tablet,Compact tablet with high performance Sharable fresh-thinking contingency.,349.19,Electronics
Cookbook,Recipes from around the world Switchable dedicated definition.,441.78,Books
Biography,Inspirational biography of a famous person Implemented client-driven structure.,83.8,Books
Jacket,Warm jacket for cold weather Cross-platform asymmetric alliance.,350.12,Clothing
Board Game,Fun board game for family and friends Organic solution-oriented knowledge user.,488.82,Toys
Bluetooth Speaker,Wireless speaker with great quality Team-oriented contextually-based hierarchy.,251.68,Gadgets
RC Car,Remote-controlled car with high speed Managed even-keeled process improvement.,460.53,Toys
Puzzle,Challenging puzzle to solve Enhanced radical paradigm.,355.98,Toys
Building Blocks,Creative building blocks for kids Vision-oriented uniform archive.,348.41,Toys
Laptop,Portable computer for all your needs Business-focused stable encoding.,237.63,Electronics
Doll,Beautiful doll with accessories Right-sized composite Internet solution.,127.68,Toys
Headphones,Headphones with noise cancellation Cross-group transitional ability.,147.18,Electronics
Biography,Inspirational biography of a famous person User-friendly interactive attitude.,204.98,Books
Smartphone,A high-tech gadget with reliability Versatile client-server function.,355.91,Electronics
Hat,Cool hat for sunny days Object-based human-resource hardware.,38.18,Clothing
Puzzle,Challenging puzzle to solve Assimilated scalable pricing structure.,200.38,Toys
Board Game,Fun board game for family and friends Streamlined fresh-thinking algorithm.,178.33,Toys
Mystery Novel,A gripping mystery novel Right-sized modular analyzer.,453.2,Books
Sneakers,Trendy sneakers with good grip Ameliorated user-facing solution.,414.6,Clothing
Camera,Digital camera with high resolution Grass-roots holistic process improvement.,196.78,Electronics
Microwave,Compact microwave for quick meals Robust discrete extranet.,96.28,Home
Smartwatch,Smartwatch with fitness tracking Down-sized zero tolerance system engine.,176.58,Electronics
Vacuum Cleaner,Efficient cleaning for your home Realigned object-oriented functionalities.,314.87,Home
Board Game,Fun board game for family and friends Programmable heuristic matrix.,360.7,Toys
Drone,Quadcopter with HD camera Cloned multi-tasking knowledgebase.,305.92,Gadgets
Jeans,Stylish denim jeans Intuitive methodical neural-net.,233.81,Clothing
Biography,Inspirational biography of a famous person Synergistic encompassing workforce.,227.0,Books
Bluetooth Speaker,Wireless speaker with great quality Exclusive empowering project.,304.82,Gadgets
Vacuum Cleaner,Efficient cleaning for your home Networked disintermediate leverage.,103.32,Home
Fantasy Novel,An epic fantasy adventure Polarized exuding capacity.,170.71,Books
Jacket,Warm jacket for cold weather Operative transitional time-frame.,490.26,Clothing
Smart Home Hub,Central hub for all your smart devices Compatible asymmetric instruction set.,14.17,Gadgets
Building Blocks,Creative building blocks for kids Inverse 6thgeneration benchmark.,97.89,Toys
Refrigerator,Large capacity fridge with freezer Adaptive user-facing database.,196.78,Home
Fantasy Novel,An epic fantasy adventure Horizontal context-sensitive leverage.,231.42,Books
Science Fiction,Futuristic science fiction story Extended local collaboration.,357.16,Books
Building Blocks,Creative building blocks for kids Total responsive core.,471.19,Toys
Vacuum Cleaner,Efficient cleaning for your home Robust non-volatile pricing structure.,358.63,Home
Board Game,Fun board game for family and friends Function-based bandwidth-monitored policy.,150.09,Toys
Microwave,Compact microwave for quick meals Organized tertiary productivity.,320.55,Home
Jacket,Warm jacket for cold weather Extended zero tolerance support.,337.79,Clothing
RC Car,Remote-controlled car with high speed Inverse content-based support.,308.72,Toys
Bluetooth Speaker,Wireless speaker with great quality Proactive bottom-line focus group.,454.49,Gadgets
Headphones,Headphones with noise cancellation Open-architected analyzing throughput.,235.51,Electronics
