name,description,price,category
Science Fiction,Futuristic science fiction story Intuitive composite synergy.,477.33,Books
Hat,Cool hat for sunny days Organized 5thgeneration system engine.,404.2,Clothing
Smartwatch,Smartwatch with fitness tracking Programmable dedicated Local Area Network.,374.36,Electronics
Jacket,Warm jacket for cold weather Team-oriented mobile toolset.,262.58,Clothing
Portable Charger,High capacity portable charger Programmable 24hour budgetary management.,434.66,Gadgets
Sneakers,Trendy sneakers with good grip Horizontal optimal moderator.,409.03,Clothing
Smartwatch,Smartwatch with fitness tracking Managed bottom-line parallelism.,210.27,Electronics
Dishwasher,Automatic dishwasher for easy cleaning Reverse-engineered uniform open system.,441.52,Home
Headphones,Headphones with noise cancellation Inverse 6thgeneration flexibility.,279.48,Electronics
Bluetooth Speaker,Wireless speaker with great quality Multi-channeled actuating function.,294.83,Gadgets
Biography,Inspirational biography of a famous person Open-source 4thgeneration emulation.,229.62,Books
Hat,Cool hat for sunny days Upgradable eco-centric methodology.,329.99,Clothing
Sofa,Comfortable and stylish seating Self-enabling asymmetric orchestration.,288.64,Home
Jacket,Warm jacket for cold weather Front-line explicit moratorium.,213.99,Clothing
Self-Help,Guide to personal development and success Programmable bi-directional analyzer.,18.86,Books
Portable Charger,High capacity portable charger Open-source high-level functionalities.,287.16,Gadgets
T-shirt,Comfortable cotton t-shirt Synchronized uniform customer loyalty.,194.33,Clothing
Vacuum Cleaner,Efficient cleaning for your home Ameliorated maximized Graphic Interface.,125.78,Home
Science Fiction,Futuristic science fiction story Synchronized optimizing strategy.,20.99,Books
Hat,Cool hat for sunny days Balanced non-volatile infrastructure.,342.23,Clothing
Board Game,Fun board game for family and friends Reactive even-keeled complexity.,224.74,Toys
RC Car,Remote-controlled car with high speed Configurable didactic monitoring.,37.72,Toys
Dishwasher,Automatic dishwasher for easy cleaning Open-source coherent implementation.,324.54,Home
Bluetooth Speaker,Wireless speaker with great quality Programmable demand-driven architecture.,451.16,Gadgets
Biography,Inspirational biography of a famous person Automated 4thgeneration array.,164.35,Books
Drone,Quadcopter with HD camera Multi-tiered mission-critical initiative.,151.26,Gadgets
Laptop,Portable computer for all your needs Centralized human-resource budgetary management.,15.76,Electronics
Camera,Digital camera with high resolution Reduced non-volatile matrices.,177.49,Electronics
Laptop,Portable computer for all your needs Organic actuating alliance.,172.27,Electronics
RC Car,Remote-controlled car with high speed De-engineered systematic groupware.,214.23,Toys
Jacket,Warm jacket for cold weather Distributed 4thgeneration capacity.,476.25,Clothing
VR Headset,Virtual reality headset for fun Mandatory asymmetric collaboration.,449.06,Gadgets
Jacket,Warm jacket for cold weather Future-proofed regional circuit.,290.89,Clothing
Jacket,Warm jacket for cold weather Balanced 4thgeneration matrix.,431.67,Clothing
Laptop,Portable computer for all your needs Virtual next generation benchmark.,130.04,Electronics
Mystery Novel,A gripping mystery novel Team-oriented dynamic product.,451.4,Books
Bluetooth Speaker,Wireless speaker with great quality Centralized 24/7 core.,14.51,Gadgets
Sneakers,Trendy sneakers with good grip Virtual homogeneous capacity.,402.72,Clothing
Smart Light Bulb,Energy-efficient smart light bulb Function-based zero tolerance Graphic Interface.,403.01,Gadgets
Smartwatch,Smartwatch with fitness tracking Organic secondary application.,459.83,Electronics
Dishwasher,Automatic dishwasher for easy cleaning Switchable system-worthy ability.,197.75,Home
Vacuum Cleaner,Efficient cleaning for your home Programmable mission-critical open system.,168.12,Home
Refrigerator,Large capacity fridge with freezer Balanced even-keeled collaboration.,345.81,Home
Action Figure,Detailed action figure from popular series Team-oriented even-keeled capability.,258.27,Toys
Drone,Quadcopter with HD camera Down-sized motivating concept.,365.49,Gadgets
Sofa,Comfortable and stylish seating Automated eco-centric function.,209.55,Home
Jacket,Warm jacket for cold weather Object-based value-added budgetary management.,68.63,Clothing
Fantasy Novel,An epic fantasy adventure Decentralized zero tolerance moderator.,466.11,Books
Dishwasher,Automatic dishwasher for easy cleaning Implemented demand-driven hardware.,209.53,Home
T-shirt,Comfortable cotton t-shirt Organic optimizing paradigm.,493.56,Clothing
Laptop,Portable computer for all your needs Upgradable 4thgeneration concept.,339.29,Electronics
Action Figure,Detailed action figure from popular series Customer-focused static approach.,53.01,Toys
Sofa,Comfortable and stylish seating Automated human-resource capacity.,258.81,Home
Headphones,Headphones with noise cancellation Implemented 24/7 projection.,175.0,Electronics
Dishwasher,Automatic dishwasher for easy cleaning Sharable transitional monitoring.,219.75,Home
Doll,Beautiful doll with accessories Expanded tertiary implementation.,433.9,Toys
Lamp,Elegant lamp for ambient lighting Secured system-worthy definition.,414.6,Home
Sneakers,Trendy sneakers with good grip Persistent dedicated model.,405.05,Clothing
Building Blocks,Creative building blocks for kids Vision-oriented multi-state policy.,172.38,Toys
Doll,Beautiful doll with accessories Polarized scalable portal.,368.5,Toys
Hat,Cool hat for sunny days Exclusive leadingedge definition.,272.82,Clothing
RC Car,Remote-controlled car with high speed Operative impactful superstructure.,115.52,Toys
Mystery Novel,A gripping mystery novel Horizontal multi-tasking system engine.,288.16,Books
Smartwatch,Smartwatch with fitness tracking Streamlined secondary Local Area Network.,159.12,Electronics
VR Headset,Virtual reality headset for fun Optimized national policy.,238.67,Gadgets
Smart Home Hub,Central hub for all your smart devices Optimized global complexity.,389.95,Gadgets
VR Headset,Virtual reality headset for fun Seamless mobile capability.,95.07,Gadgets
Smart Home Hub,Central hub for all your smart devices Fundamental systematic middleware.,229.91,Gadgets
Vacuum Cleaner,Efficient cleaning for your home Programmable 4thgeneration Graphic Interface.,404.0,Home
VR Headset,Virtual reality headset for fun Fundamental interactive solution.,383.03,Gadgets
T-shirt,Comfortable cotton t-shirt Balanced neutral strategy.,493.47,Clothing
Scarf,Cozy scarf for winter Digitized next generation infrastructure.,239.64,Clothing
Camera,Digital camera with high resolution Operative leadingedge artificial intelligence.,169.08,Electronics
Mystery Novel,A gripping mystery novel Automated encompassing database.,72.5,Books
Tablet,Compact tablet with high performance Networked client-driven collaboration.,127.57,Electronics
Scarf,Cozy scarf for winter Front-line global contingency.,152.25,Clothing
RC Car,Remote-controlled car with high speed Multi-layered non-volatile budgetary management.,480.56,Toys
Cookbook,Recipes from around the world Stand-alone neutral challenge.,388.08,Books
Headphones,Headphones with noise cancellation Multi-channeled real-time standardization.,140.67,Electronics
Science Fiction,Futuristic science fiction story Pre-emptive object-oriented forecast.,309.08,Books
Jacket,Warm jacket for cold weather Switchable upward-trending neural-net.,295.59,Clothing
Cookbook,Recipes from around the world Enhanced didactic adapter.,283.28,Books
Bluetooth Speaker,Wireless speaker with great quality Multi-layered zero tolerance hierarchy.,208.32,Gadgets
Board Game,Fun board game for family and friends Horizontal tertiary framework.,237.95,Toys
Refrigerator,Large capacity fridge with freezer Up-sized fault-tolerant ability.,113.39,Home
Drone,Quadcopter with HD camera Multi-layered bottom-line methodology.,81.26,Gadgets
Portable Charger,High capacity portable charger Profit-focused grid-enabled software.,76.33,Gadgets
T-shirt,Comfortable cotton t-shirt Advanced explicit parallelism.,61.59,Clothing
Headphones,Headphones with noise cancellation Integrated 6thgeneration capacity.,456.84,Electronics
Sofa,Comfortable and stylish seating Fundamental system-worthy policy.,13.41,Home
Sneakers,Trendy sneakers with good grip Persevering asymmetric moratorium.,407.08,Clothing
Mystery Novel,A gripping mystery novel Open-source tangible project.,400.82,Books
Dishwasher,Automatic dishwasher for easy cleaning Fundamental bi-directional contingency.,77.65,Home
Jacket,Warm jacket for cold weather Persevering content-based success.,78.86,Clothing
Scarf,Cozy scarf for winter Devolved modular parallelism.,479.64,Clothing
Smartphone,A high-tech gadget with reliability Phased web-enabled implementation.,29.64,Electronics
Hat,Cool hat for sunny days Managed multi-tasking budgetary management.,234.97,Clothing
Science Fiction,Futuristic science fiction story Re-engineered web-enabled Graphic Interface.,142.73,Books
Mystery Novel,A gripping mystery novel Reduced radical database.,88.41,Books
Lamp,Elegant lamp for ambient lighting Synergistic asymmetric data-warehouse.,400.96,Home
RC Car,Remote-controlled car with high speed Synergized neutral frame.,115.26,Toys
Scarf,Cozy scarf for winter Mandatory impactful contingency.,235.29,Clothing
Portable Charger,High capacity portable charger Business-focused holistic infrastructure.,450.81,Gadgets
Building Blocks,Creative building blocks for kids Seamless exuding alliance.,473.67,Toys
Mystery Novel,A gripping mystery novel Innovative disintermediate website.,333.58,Books
RC Car,Remote-controlled car with high speed Expanded homogeneous budgetary management.,386.45,Toys
Hat,Cool hat for sunny days Reduced upward-trending capability.,9.67,Clothing
Fantasy Novel,An epic fantasy adventure Devolved tangible moratorium.,212.24,Books
Microwave,Compact microwave for quick meals Upgradable mobile algorithm.,257.02,Home
Lamp,Elegant lamp for ambient lighting Open-source methodical groupware.,400.59,Home
Action Figure,Detailed action figure from popular series Fundamental logistical website.,230.39,Toys
Bluetooth Speaker,Wireless speaker with great quality Reduced bi-directional projection.,236.6,Gadgets
RC Car,Remote-controlled car with high speed Universal zero tolerance core.,283.52,Toys
Jeans,Stylish denim jeans Polarized bifurcated adapter.,182.82,Clothing
Bluetooth Speaker,Wireless speaker with great quality Profit-focused leadingedge hierarchy.,249.52,Gadgets
Cookbook,Recipes from around the world Face-to-face attitude-oriented application.,262.98,Books
Smart Light Bulb,Energy-efficient smart light bulb Multi-tiered global customer loyalty.,194.01,Gadgets
Bluetooth Speaker,Wireless speaker with great quality Intuitive reciprocal intranet.,145.78,Gadgets
Microwave,Compact microwave for quick meals Distributed didactic analyzer.,136.45,Home
Vacuum Cleaner,Efficient cleaning for your home Advanced transitional encoding.,11.33,Home
Lamp,Elegant lamp for ambient lighting Virtual user-facing open architecture.,162.72,Home
RC Car,Remote-controlled car with high speed Sharable background superstructure.,181.77,Toys
Tablet,Compact tablet with high performance Reduced 24/7 database.,235.85,Electronics
Smartphone,A high-tech gadget with reliability Innovative context-sensitive challenge.,274.67,Electronics
Cookbook,Recipes from around the world Balanced zero-defect open architecture.,345.73,Books
Hat,Cool hat for sunny days Diverse coherent installation.,78.92,Clothing
Refrigerator,Large capacity fridge with freezer Multi-lateral modular application.,265.33,Home
Puzzle,Challenging puzzle to solve Face-to-face radical algorithm.,177.44,Toys
Microwave,Compact microwave for quick meals Synergized even-keeled framework.,24.15,Home
Hat,Cool hat for sunny days Visionary stable system engine.,477.87,Clothing
Refrigerator,Large capacity fridge with freezer Multi-lateral disintermediate hardware.,477.7,Home
Smart Home Hub,Central hub for all your smart devices Digitized user-facing synergy.,455.62,Gadgets
Scarf,Cozy scarf for winter Polarized client-driven moratorium.,314.67,Clothing
Jacket,Warm jacket for cold weather Advanced radical forecast.,437.77,Clothing
VR Headset,Virtual reality headset for fun Visionary reciprocal knowledge user.,95.29,Gadgets
T-shirt,Comfortable cotton t-shirt Distributed demand-driven adapter.,199.44,Clothing
Doll,Beautiful doll with accessories Pre-emptive context-sensitive complexity.,174.31,Toys
Building Blocks,Creative building blocks for kids Implemented analyzing architecture.,308.45,Toys
VR Headset,Virtual reality headset for fun Polarized explicit secured line.,304.79,Gadgets
Jeans,Stylish denim jeans Robust regional moderator.,279.26,Clothing
Portable Charger,High capacity portable charger Upgradable discrete attitude.,193.69,Gadgets
Smart TV,High-definition smart television Assimilated multi-state protocol.,135.88,Electronics
Dishwasher,Automatic dishwasher for easy cleaning Realigned incremental installation.,338.37,Home
Scarf,Cozy scarf for winter Phased homogeneous strategy.,51.62,Clothing
Vacuum Cleaner,Efficient cleaning for your home Reduced high-level superstructure.,202.55,Home
Doll,Beautiful doll with accessories Reduced explicit adapter.,443.0,Toys
Smart Light Bulb,Energy-efficient smart light bulb Pre-emptive web-enabled solution.,175.54,Gadgets
Cookbook,Recipes from around the world Profit-focused didactic definition.,43.03,Books
Hat,Cool hat for sunny days Managed upward-trending neural-net.,322.9,Clothing
Drone,Quadcopter with HD camera Cross-platform analyzing emulation.,238.77,Gadgets
Fantasy Novel,An epic fantasy adventure Synchronized multi-state leverage.,139.63,Books
Hat,Cool hat for sunny days Ameliorated reciprocal knowledgebase.,226.59,Clothing
Headphones,Headphones with noise cancellation Automated static portal.,361.46,Electronics
Lamp,Elegant lamp for ambient lighting Mandatory secondary function.,240.21,Home
Sofa,Comfortable and stylish seating Digitized executive concept.,85.06,Home
Scarf,Cozy scarf for winter Integrated zero-defect artificial intelligence.,341.29,Clothing
Dishwasher,Automatic dishwasher for easy cleaning Organized composite hub.,269.52,Home
Smart Home Hub,Central hub for all your smart devices Open-source radical benchmark.,175.61,Gadgets
Smart Light Bulb,Energy-efficient smart light bulb Progressive transitional ability.,64.71,Gadgets
Action Figure,Detailed action figure from popular series Future-proofed didactic open system.,479.38,Toys
Smart Light Bulb,Energy-efficient smart light bulb Fully-configurable national knowledge user.,376.92,Gadgets
Building Blocks,Creative building blocks for kids Polarized actuating leverage.,296.75,Toys
Laptop,Portable computer for all your needs Grass-roots solution-oriented hierarchy.,128.43,Electronics
Smart Light Bulb,Energy-efficient smart light bulb Fundamental 24/7 algorithm.,415.4,Gadgets
Sneakers,Trendy sneakers with good grip Programmable discrete standardization.,16.03,Clothing
Smart TV,High-definition smart television Multi-tiered multi-tasking forecast.,109.74,Electronics
RC Car,Remote-controlled car with high speed Streamlined exuding budgetary management.,135.73,Toys
Headphones,Headphones with noise cancellation Multi-layered web-enabled toolset.,250.24,Electronics
Science Fiction,Futuristic science fiction story Automated high-level extranet.,42.67,Books
Self-Help,Guide to personal development and success Managed logistical alliance.,35.37,Books
Drone,Quadcopter with HD camera Front-line executive contingency.,34.11,Gadgets
Sneakers,Trendy sneakers with good grip Multi-tiered leadingedge framework.,331.01,Clothing
Building Blocks,Creative building blocks for kids Progressive 24/7 protocol.,210.1,Toys
Drone,Quadcopter with HD camera Managed object-oriented collaboration.,492.5,Gadgets
Action Figure,Detailed action figure from popular series Cross-platform stable matrices.,272.55,Toys
Scarf,Cozy scarf for winter Right-sized interactive service-desk.,210.96,Clothing
Bluetooth Speaker,Wireless speaker with great quality Programmable multimedia implementation.,193.21,Gadgets
Vacuum Cleaner,Efficient cleaning for your home Networked optimal time-frame.,381.29,Home
Cookbook,Recipes from around the world Organic coherent strategy.,163.16,Books
Lamp,Elegant lamp for ambient lighting Inverse zero tolerance budgetary management.,302.64,Home
Sofa,Comfortable and stylish seating Multi-tiered composite throughput.,303.58,Home
Scarf,Cozy scarf for winter User-centric motivating moderator.,284.35,Clothing
Fantasy Novel,An epic fantasy adventure Decentralized stable neural-net.,258.98,Books
Biography,Inspirational biography of a famous person Fundamental 5thgeneration project.,281.73,Books
Refrigerator,Large capacity fridge with freezer Open-architected web-enabled intranet.,264.89,Home
Laptop,Portable computer for all your needs Triple-buffered bi-directional middleware.,227.88,Electronics
Vacuum Cleaner,Efficient cleaning for your home Multi-tiered client-driven database.,83.28,Home
Microwave,Compact microwave for quick meals Business-focused heuristic Internet solution.,428.61,Home
Jeans,Stylish denim jeans Ameliorated grid-enabled database.,317.19,Clothing
Smartwatch,Smartwatch with fitness tracking Vision-oriented tertiary emulation.,261.11,Electronics
Cookbook,Recipes from around the world Re-engineered web-enabled middleware.,86.87,Books
Puzzle,Challenging puzzle to solve Function-based intangible flexibility.,39.51,Toys
Smart TV,High-definition smart television Total scalable secured line.,49.67,Electronics
Smart Home Hub,Central hub for all your smart devices Proactive tangible monitoring.,427.75,Gadgets
Cookbook,Recipes from around the world Compatible 6thgeneration methodology.,316.02,Books
Portable Charger,High capacity portable charger User-centric asymmetric Local Area Network.,408.64,Gadgets
T-shirt,Comfortable cotton t-shirt Synchronized static focus group.,294.48,Clothing
Building Blocks,Creative building blocks for kids Focused eco-centric firmware.,387.0,Toys
Portable Charger,High capacity portable charger Secured client-server website.,421.11,Gadgets
Tablet,Compact tablet with high performance Self-enabling intermediate migration.,482.93,Electronics
Fantasy Novel,An epic fantasy adventure Re-engineered tertiary complexity.,407.38,Books
Cookbook,Recipes from around the world Programmable 24/7 budgetary management.,433.91,Books
Fantasy Novel,An epic fantasy adventure Progressive web-enabled time-frame.,9.5,Books
Smartphone,A high-tech gadget with reliability Balanced object-oriented extranet.,498.33,Electronics
Sofa,Comfortable and stylish seating Optional even-keeled synergy.,412.24,Home
Tablet,Compact tablet with high performance Ameliorated local capability.,448.37,Electronics
Smart Home Hub,Central hub for all your smart devices Ergonomic executive hierarchy.,405.82,Gadgets
Smart Home Hub,Central hub for all your smart devices Optimized dynamic support.,438.78,Gadgets
Cookbook,Recipes from around the world Innovative dynamic challenge.,253.82,Books
T-shirt,Comfortable cotton t-shirt Team-oriented optimal capacity.,380.15,Clothing
Sneakers,Trendy sneakers with good grip Re-engineered static intranet.,254.28,Clothing
Hat,Cool hat for sunny days Visionary secondary structure.,9.07,Clothing
Puzzle,Challenging puzzle to solve Persistent client-driven open system.,467.49,Toys
Smart TV,High-definition smart television Integrated dynamic structure.,480.67,Electronics
Smart Home Hub,Central hub for all your smart devices Upgradable zero tolerance encoding.,354.11,Gadgets
Lamp,Elegant lamp for ambient lighting Switchable global hardware.,88.95,Home
Jeans,Stylish denim jeans Switchable static function.,477.93,Clothing
Smart Light Bulb,Energy-efficient smart light bulb Enhanced foreground infrastructure.,352.19,Gadgets
Sofa,Comfortable and stylish seating Profound 24hour artificial intelligence.,195.18,Home
Board Game,Fun board game for family and friends Customer-focused global framework.,99.91,Toys
Dishwasher,Automatic dishwasher for easy cleaning Synergized user-facing process improvement.,214.24,Home
Smart Home Hub,Central hub for all your smart devices Virtual system-worthy utilization.,300.0,Gadgets
Mystery Novel,A gripping mystery novel Implemented systematic throughput.,161.9,Books
Bluetooth Speaker,Wireless speaker with great quality Realigned composite adapter.,163.32,Gadgets
Portable Charger,High capacity portable charger Sharable systematic open architecture.,343.12,Gadgets
VR Headset,Virtual reality headset for fun Adaptive encompassing neural-net.,237.02,Gadgets
Biography,Inspirational biography of a famous person Upgradable discrete hierarchy.,322.9,Books
Camera,Digital camera with high resolution Ergonomic full-range focus group.,270.39,Electronics
Dishwasher,Automatic dishwasher for easy cleaning Re-contextualized upward-trending Graphic Interface.,260.38,Home
Doll,Beautiful doll with accessories Business-focused coherent throughput.,473.08,Toys
Smart Home Hub,Central hub for all your smart devices Re-engineered next generation functionalities.,174.77,Gadgets
Sneakers,Trendy sneakers with good grip Fundamental web-enabled middleware.,83.67,Clothing
Smart TV,High-definition smart television Vision-oriented exuding Internet solution.,414.71,Electronics
Biography,Inspirational biography of a famous person Integrated holistic forecast.,152.9,Books
Laptop,Portable computer for all your needs Operative radical website.,142.36,Electronics
VR Headset,Virtual reality headset for fun Multi-tiered even-keeled forecast.,54.91,Gadgets
Self-Help,Guide to personal development and success Proactive executive neural-net.,255.19,Books
Cookbook,Recipes from around the world User-friendly modular approach.,468.69,Books
Smartphone,A high-tech gadget with reliability Mandatory zero administration collaboration.,312.93,Electronics
Sneakers,Trendy sneakers with good grip Progressive uniform project.,453.78,Clothing
Vacuum Cleaner,Efficient cleaning for your home Managed tertiary core.,352.64,Home
Bluetooth Speaker,Wireless speaker with great quality Object-based reciprocal knowledge user.,343.72,Gadgets
Jeans,Stylish denim jeans Object-based bifurcated architecture.,48.59,Clothing
Drone,Quadcopter with HD camera Fundamental zero-defect Internet solution.,425.83,Gadgets
Jeans,Stylish denim jeans Expanded heuristic architecture.,349.56,Clothing
Smart Light Bulb,Energy-efficient smart light bulb Extended 24hour moderator.,260.25,Gadgets
Fantasy Novel,An epic fantasy adventure Cross-group responsive matrix.,303.5,Books
Dishwasher,Automatic dishwasher for easy cleaning Inverse transitional paradigm.,154.38,Home
Puzzle,Challenging puzzle to solve Multi-layered methodical strategy.,341.2,Toys
Sneakers,Trendy sneakers with good grip Sharable grid-enabled groupware.,81.84,Clothing
Jeans,Stylish denim jeans Diverse transitional conglomeration.,451.9,Clothing
Board Game,Fun board game for family and friends Synergized scalable structure.,384.78,Toys
RC Car,Remote-controlled car with high speed Profit-focused exuding attitude.,465.68,Toys
Sofa,Comfortable and stylish seating Grass-roots clear-thinking forecast.,24.76,Home
Doll,Beautiful doll with accessories Total 6thgeneration help-desk.,390.94,Toys
Puzzle,Challenging puzzle to solve Open-source logistical system engine.,275.39,Toys
Sneakers,Trendy sneakers with good grip Ameliorated logistical projection.,426.38,Clothing
Portable Charger,High capacity portable charger Mandatory impactful service-desk.,408.88,Gadgets
Sneakers,Trendy sneakers with good grip Universal actuating encryption.,376.23,Clothing
Smartphone,A high-tech gadget with reliability Re-contextualized client-server flexibility.,23.88,Electronics
Microwave,Compact microwave for quick meals Total contextually-based circuit.,80.5,Home
Mystery Novel,A gripping mystery novel Assimilated explicit software.,255.77,Books
Laptop,Portable computer for all your needs Up-sized multi-state adapter.,403.95,Electronics
Smartwatch,Smartwatch with fitness tracking Innovative methodical protocol.,444.99,Electronics
Microwave,Compact microwave for quick meals Future-proofed even-keeled algorithm.,352.94,Home
RC Car,Remote-controlled car with high speed Programmable multi-tasking budgetary management.,14.14,Toys
Cookbook,Recipes from around the world Implemented high-level forecast.,79.6,Books
RC Car,Remote-controlled car with high speed Re-contextualized client-driven customer loyalty.,20.26,Toys
Sneakers,Trendy sneakers with good grip Upgradable 3rdgeneration benchmark.,378.49,Clothing
Doll,Beautiful doll with accessories Cloned client-driven firmware.,440.71,Toys
Science Fiction,Futuristic science fiction story Realigned uniform firmware.,402.64,Books
Dishwasher,Automatic dishwasher for easy cleaning Operative neutral paradigm.,209.75,Home
Smart TV,High-definition smart television Self-enabling discrete attitude.,217.47,Electronics
Smart Light Bulb,Energy-efficient smart light bulb Realigned system-worthy benchmark.,325.91,Gadgets
Hat,Cool hat for sunny days Progressive asymmetric framework.,450.46,Clothing
RC Car,Remote-controlled car with high speed Robust human-resource budgetary management.,369.48,Toys
Lamp,Elegant lamp for ambient lighting Robust multi-tasking synergy.,269.76,Home
Puzzle,Challenging puzzle to solve Virtual demand-driven toolset.,24.47,Toys
Drone,Quadcopter with HD camera Virtual methodical methodology.,407.98,Gadgets
Sofa,Comfortable and stylish seating Sharable multi-tasking adapter.,235.55,Home
Jeans,Stylish denim jeans Ameliorated 6thgeneration utilization.,205.94,Clothing
Smart Home Hub,Central hub for all your smart devices Extended exuding portal.,113.42,Gadgets
Building Blocks,Creative building blocks for kids Innovative non-volatile success.,276.55,Toys
